{
  "opportunity_id": "OPP-vLlIBT0HSSc-fde-delivery-shape",
  "what_became_possible": "Name and sit in the demo-works / customer-mess-does-not gap as a delivery or career-gym fragment — without a Palantir hunt.",
  "leverage": "Path A already lives here (parked). Career gym adds clarify-first case study. Tape $ UNVERIFIED.",
  "possible_product_service": "Not a new icp_id. Delivery shape / case-study gym only.",
  "may_improve_desks": [
    "consultant",
    "career-strategist",
    "forge"
  ],
  "may_be_standalone": false,
  "capability_id": "CAP-vLlIBT0HSSc-forward-deployed-gap",
  "source_video_id": "vLlIBT0HSSc",
  "tape_dollars": "UNVERIFIED",
  "new_icp_id": null,
  "status": "UNTESTED"
}
